{
  "company_name": "Синтетика Лаб",
  "fact": "Синтетика Лаб разработала учебный сервис, который помогает командам проверять качество публичных текстов перед публикацией.",
  "source_id": "p02",
  "source_excerpt": "Синтетика Лаб разработала учебный сервис, который помогает командам проверять качество публичных текстов перед публикацией.",
  "source_type": "about",
  "published_at": null,
  "confidence": 0.99,
  "decision": "READY_FOR_REVIEW",
  "warnings": ["SYNTHETIC_FIXTURE_ONLY"]
}
